[
    {
        "ticket_number": "Ticket01",
        "client": "AccountTest",
        "short_description": "ShortTest",
        "tuc": "TUCTest",
        "severity": 3,
        "assigned_to": "L1 Team",
        "content": "Ticket Number: Ticket01\nAccount: AccountTest\nShort Description: ShortTest\nTUC: TUCTest\nSeverity: 3\nAssigned To: L1 Team\nTime: 2024-12-30 13:03:55\nContent:\nTicket Number: Ticket01\nAccount: AccountTest\nShort Description: ShortTest\nTUC: TUCTest\nSeverity: 3\nAssigned To: L1 Team\n\n####INVESTIGATION DETAILS####\n\n## Phishing Investigation\n\nCause: Phishing\nHora: 12/12/24\nSourceIP: 64.22.110.7\nHostIP: 192.168.1.1\nEmail: test@test.cl\nUser: eduardo@test.cl\n\n\n\nROOT CAUSE\n\nOn [12/12/24], the alert '[Phishing]' was triggered at [test@test.cl]. The investigation determined that the root cause was '[TUCTest]', involving '[64.22.110.7]'.",
        "parsed_info": "Ticket Number: Ticket01\nAccount: AccountTest\nShort Description: ShortTest\nTUC: TUCTest\nSeverity: 3\nAssigned To: L1 Team\nTime: 2024-12-30 13:03:55\nContent: Ticket Number: Ticket01\nPhishing Investigation\n\nCause: Phishing\nHora: 12/12/24\nSourceIP: 64.22.110.7\nHostIP: 192.168.1.1\nEmail: test@test.cl\nUser: eduardo@test.cl",
        "timestamp": "2024-12-30 17:07:55"
    },
    {
        "ticket_number": "Ticket02",
        "client": "Client A",
        "short_description": "ShortTest",
        "tuc": "TUC123",
        "severity": 1,
        "assigned_to": "L1 Team",
        "content": "Ticket Number: Ticket02\nAccount: Client A\nShort Description: ShortTest\nTUC: TUC123\nSeverity: 1\nAssigned To: L1 Team\nEscalado: S\u00ed\nEstado: Abierto\n\n####INVESTIGATION DETAILS####\n\n## Phishing Investigation\n\nCause: Phishing\nHora: 12/12/24\nSourceIP: 64.22.110.7\nHostIP: 192.168.1.1\nEmail: test@test.cl\nUser: eduardo@test.cl\n\n\n\nROOT CAUSE\n\nOn [12/12/24], the alert '[Phishing]' was triggered at [test@test.cl]. The investigation determined that the root cause was '[TUCTest]', involving '[64.22.110.7]'.",
        "parsed_info": "Ticket Number: Ticket02\nAccount: Client A\nShort Description: ShortTest\nTUC: TUC123\nSeverity: 1\nAssigned To: L1 Team\nEscalado: S\u00ed\nEstado: Abierto\nPhishing Investigation\n\nCause: Phishing\nHora: 12/12/24\nSourceIP: 64.22.110.7\nHostIP: 192.168.1.1\nEmail: test@test.cl\nUser: eduardo@test.cl",
        "timestamp": "2024-12-30 17:19:56"
    },
    {
        "ticket_number": "Ticket03",
        "client": "Cliente C",
        "short_description": "Descripcion Corta",
        "tuc": "TUC0808",
        "severity": 2,
        "assigned_to": "L1 Team",
        "content": "########TICKET DETAILS########\nTicket Number: Ticket03\nAccount: Cliente C\nShort Description: Descripcion Corta\nTUC: TUC0808\nSeverity: 2\nAssigned To: L1 Team\nEscalado: No\nEstado: Abierto\n########INVESTIGATION DETAILS########\n\n## Phishing Investigation\n\nCause: Phishing\nHora: 12/12/24\nSourceIP: 64.22.110.7\nHostIP: 192.168.1.1\nEmail: test@test.cl\nUser: eduardo@test.cl\nCause: Click on URL\nRule Purpose: This Alert Triggered because asdf\n\n\nROOT CAUSE\n\nOn [12/12/24], the alert '[Phishing]' was triggered at [eduardo@test.cl]. The investigation determined that the root cause was '[This Alert Triggered because asdf]', involving '[64.22.110.7]'.",
        "parsed_info": "Ticket Number: Ticket03\nAccount: Cliente C\nShort Description: Descripcion Corta\nTUC: TUC0808\nSeverity: 2\nAssigned To: L1 Team\nEscalado: No\nEstado: Abierto\nPhishing Investigation\n\nCause: Phishing\nHora: 12/12/24\nSourceIP: 64.22.110.7\nHostIP: 192.168.1.1\nEmail: test@test.cl\nUser: eduardo@test.cl\nCause: Click on URL\nRule Purpose: This Alert Triggered because asdf",
        "timestamp": "2025-01-15 14:01:06"
    },
    {
        "ticket_number": "TB0803",
        "client": "Tosuelo",
        "short_description": "SOC326 - Impersonating Domain MX Record Change Detected",
        "tuc": "TUC0804",
        "severity": 3,
        "assigned_to": "L1 Team",
        "content": "########TICKET DETAILS########\nTicket Number: TB0803\nAccount: Tosuelo\nShort Description: SOC326 - Impersonating Domain MX Record Change Detected\n\nTUC: TUC0804\nSeverity: 3\nAssigned To: L1 Team\nEscalado: No\nEstado: Abierto\n########INVESTIGATION DETAILS########\n\nCause:  Impersonating Domain MX Record Change Detected\nHora: Sep, 17, 2024, 12:05 PM\nSource Address: no-reply@ctireport.io\nDestination Address: soc@letsdefend.io\nRule Purpose: The MX record of a suspicious domain was changed, suggesting potential phishing activity.\nAction: Allowed\n\nROOT CAUSE\n\nOn [Sep, 17, 2024, 12:05 PM], the security event '[Impersonating Domain MX Record Change Detected]' occurred at [soc@letsdefend.io]. Analysis identified '[The MX record of a suspicious domain was changed, suggesting potential phishing activity.]' as the cause, with actions involving '[no-reply@ctireport.io]'.",
        "parsed_info": "Ticket Number: TB0803\nAccount: Tosuelo\nShort Description: SOC326 - Impersonating Domain MX Record Change Detected\nTUC: TUC0804\nSeverity: 3\nAssigned To: L1 Team\nEscalado: No\nEstado: Abierto\nCause: Impersonating Domain MX Record Change Detected\nHora: Sep, 17, 2024, 12:05 PM\nSource Address: no-reply@ctireport.io\nDestination Address: soc@letsdefend.io\nRule Purpose: The MX record of a suspicious domain was changed, suggesting potential phishing activity.\nAction: Allowed\n12: 05 PM], the security event '[Impersonating Domain MX Record Change Detected]' occurred at [soc@letsdefend.io]. Analysis identified '[The MX record of a suspicious domain was changed, suggesting potential phishing activity.]' as the cause, with actions involving '[no-reply@ctireport.io]'.",
        "timestamp": "2024-12-30 18:53:16"
    },
    {
        "ticket_number": "TESTTEST",
        "client": "TESTTEST",
        "short_description": "TESTTEST",
        "tuc": "TUC123",
        "severity": 1,
        "assigned_to": "Escalado: No",
        "content": "########TICKET DETAILS########\nTicket Number: TESTTEST\nAccount: TESTTEST\nShort Description: TESTTEST\nTUC: TUC123\nSeverity: 1\nAssigned To: \nEscalado: No\nEstado: Abierto\n########INVESTIGATION DETAILS########",
        "parsed_info": "Ticket Number: TESTTEST\nAccount: TESTTEST\nShort Description: TESTTEST\nTUC: TUC123\nSeverity: 1\nAssigned To: Escalado: No\nEstado: Abierto",
        "timestamp": "2025-01-15 14:06:15"
    }
]